{
    "id": "luminance_key",
    "name": "ルミナンスキー",
    "qml": "LuminanceKey.qml",
    "params": {
        "threshold": 50,
        "blend": 10,
        "invert": false
    },
    "ui": {
        "controls": [
            {
                "type": "float",
                "param": "threshold",
                "label": "しきい値",
                "min": 0,
                "max": 100
            },
            {
                "type": "float",
                "param": "blend",
                "label": "ブレンド",
                "min": 0,
                "max": 100
            },
            {
                "type": "bool",
                "param": "invert",
                "label": "反転"
            }
        ]
    },
    "version": "1.0.0",
    "kind": "effect",
    "categories": [
        "キー"
    ]
}