{
    "id": "gradient",
    "name": "グラデーション",
    "qml": "Gradient.qml",
    "params": {
        "strength": 100,
        "centerX": 50,
        "centerY": 50,
        "angle": 0,
        "width": 100,
        "shape": 0,
        "startColor": "#00000000",
        "endColor": "#ffffffff"
    },
    "ui": {
        "controls": [
            {
                "type": "float",
                "param": "strength",
                "label": "強さ",
                "min": 0,
                "max": 200
            },
            {
                "type": "float",
                "param": "centerX",
                "label": "中心X",
                "min": 0,
                "max": 100
            },
            {
                "type": "float",
                "param": "centerY",
                "label": "中心Y",
                "min": 0,
                "max": 100
            },
            {
                "type": "float",
                "param": "angle",
                "label": "角度",
                "min": 0,
                "max": 360
            },
            {
                "type": "float",
                "param": "width",
                "label": "幅",
                "min": 1,
                "max": 200
            },
            {
                "type": "int",
                "param": "shape",
                "label": "種類",
                "min": 0,
                "max": 2
            },
            {
                "type": "color",
                "param": "startColor",
                "label": "開始色"
            },
            {
                "type": "color",
                "param": "endColor",
                "label": "終了色"
            }
        ]
    },
    "version": "1.0.0",
    "kind": "effect",
    "categories": [
        "色調補正"
    ]
}
