{
    "id": "slide",
    "name": "スライド",
    "qml": "Slide.qml",
    "params": {
        "duration": 30,
        "easing": "linear",
        "reverse": false,
        "direction": "left"
    },
    "ui": {
        "group": "transition",
        "controls": [
            {
                "type": "spinner",
                "param": "duration",
                "label": "持続フレーム",
                "min": 1,
                "max": 300,
                "step": 1
            },
            {
                "type": "enum",
                "param": "easing",
                "label": "イージング",
                "options": ["linear", "ease_in", "ease_out", "ease_in_out"]
            },
            {
                "type": "bool",
                "param": "reverse",
                "label": "反転"
            },
            {
                "type": "enum",
                "param": "direction",
                "label": "方向",
                "options": ["left", "right", "up", "down"]
            }
        ]
    },
    "version": "1.0.0",
    "kind": "transition",
    "color": "#9C27B0",
    "categories": [
        "スライド",
        "基本"
    ]
}