{
  "id": "vignette",
  "name": "ビネット",
  "qml": "Vignette.qml",
  "params": {
    "radius": 0.75,
    "softness": 0.45,
    "amount": 1.0
  },
  "ui": {
    "controls": [
      {
        "type": "slider",
        "param": "radius",
        "label": "半径",
        "min": 0.1,
        "max": 2.0,
        "step": 0.01
      },
      {
        "type": "slider",
        "param": "softness",
        "label": "ぼかし",
        "min": 0.0,
        "max": 1.0,
        "step": 0.01
      },
      {
        "type": "slider",
        "param": "amount",
        "label": "量",
        "min": 0.0,
        "max": 1.0,
        "step": 0.01
      }
    ]
  },
  "version": "1.0.0",
  "kind": "effect",
  "categories": ["カラーグレーディング"]
}
